Conjugue le verbe chanter au présent à la 3ème personne du singulier.,Il chante,Ils chantent,Il chantes
que signifie ' Goodbye ' ?,Au revoir,Bonjour,Bonne nuit
Combien d'accent circonflexe y a-t-il en tout dans les mois suivant : fevrier mai aout et decembre ?,1,2,3
Quelle est la fonction de 'en Provence' dans la phrase 'je pars en Provence' ?,Complément,Verbe,Sujet
Quel est le pluriel de journal ?,des journaux,des journales,des journos
Donne un synonyme de livre,boquin,journal,pagaille
Dans quoi mettre son jus de fruit ?,un verre,un vert,un ver
Complète la phrase : Sa mère ___ en train de préparer le repas.,est,et,ai
